_embedded_show_id,_embedded_show_url,_embedded_show_name,_embedded_show_type,_embedded_show_language,_embedded_show_genres,_embedded_show_status,_embedded_show_runtime,_embedded_show_averageRuntime,_embedded_show_premiered,_embedded_show_ended,_embedded_show_officialSite,_embedded_show_weight,_embedded_show_network,_embedded_show_dvdCountry,_embedded_show_summary,_embedded_show_updated
25294,https://www.tvmaze.com/shows/25294/ufc-fight-pass-prelims,UFC Fight Pass Prelims,Sports,English,[],Running,60.0,74.0,2017-01-15,,https://www.ufc.tv/page/fightpass,39,,,<p>Televised undercard bouts from UFC Pay-Per-Views and UFC Fight Nights exclusively on UFC Fight Pass.</p>,1646528986
50895,https://www.tvmaze.com/shows/50895/game-changer,Game Changer,Game Show,English,['Comedy'],Running,25.0,25.0,2019-09-20,,https://www.youtube.com/channel/UCPDXXXJj9nax0fr0Wfc048g,85,,,"<p>In this game show, the game changes every show! Players begin each round without knowing the rules -- and must figure them out while competing to win.</p>",1648349240
50939,https://www.tvmaze.com/shows/50939/rail-romanesque,Rail Romanesque,Animation,Japanese,"['Comedy', 'Anime', 'Science-Fiction']",Ended,5.0,5.0,2020-10-03,2020-12-19,https://railromanesque.jp,24,,,"<p>Set in Hinomoto, a fictional version of Japan, where for a long time railway travel served as the most important form of transport. Each locomotive was paired with a humanoid control module, so-called Raillord, that aided the train operator. However, many rail lines had been discontinued due to the rising popularity of ""aerocrafts,"" a safe and convenient aerial mode of transport. As such, their accompanying railroads also went into a deep sleep. Soutetsu had lost his entire family in a rail accident and was adopted into the Migita household, which runs a shochu brewery in the city of Ohitoyo. He returned to his hometown to save it from the potential water pollution that would occur if they accepted the proposal to build an aerocraft factory nearby. He woke up the Raillord Hachiroku by accident and became her owner. For different purposes, they agreed to help find her lost locomotive, with the help of his stepsister Hibiki, the town's mayor and local railway chief, Paulette and others.</p>",1645753159
53754,https://www.tvmaze.com/shows/53754/lovely-bites-by-chef-lovely,Lovely Bites by Chef Lovely,Reality,English,[],Running,25.0,25.0,2020-11-14,,https://www.oprah.com/app/lovely-bites.html,19,"{'id': 236, 'name': 'Oprah Winfrey Network', 'country': {'name': 'United States', 'code': 'US', 'timezone': 'America/New_York'}, 'officialSite': None}",,"<p>Chef Connie ""Lovely"" Jackson brings the fun with recipes that are perfect for entertaining and celebrating festive occasions. <b>Lovely Bites</b> is produced for OWN by FishBowl Worldwide Media.</p>",1623829529
51314,https://www.tvmaze.com/shows/51314/maskorama,Maskorama,Reality,Norwegian,['Music'],Running,90.0,88.0,2020-11-07,,https://tv.nrk.no/serie/maskorama,18,"{'id': 91, 'name': 'NRK1', 'country': {'name': 'Norway', 'code': 'NO', 'timezone': 'Europe/Oslo'}, 'officialSite': None}",,"<p>Based on the international hit ""The Masked Singer"", in <b>Maskorama </b>eight elebrities will face off against one another with a twist: each singer is using masks and costumes, the judges panel will have to guess which celebrity is behind the mask.</p>",1640454812
48922,https://www.tvmaze.com/shows/48922/onyx-equinox,Onyx Equinox,Animation,English,"['Action', 'Adventure', 'Fantasy']",Ended,24.0,24.0,2020-11-21,2020-12-26,https://www.crunchyroll.com/onyx-equinox,46,,,"<p>A young Aztec boy is saved from death by the gods and chosen to act as ‘humanity's champion,' forced to discard his apathy toward his fellow man and prove humanity's potential in a fight that spans across fantastical-yet-authentic Mesoamerican cultures.</p>",1609359827
51631,https://www.tvmaze.com/shows/51631/eides-spraksjov,Eides språksjov,Talk Show,Norwegian,['Comedy'],Running,,43.0,2017-01-11,,https://tv.nrk.no/serie/eides-spraaksjov,3,,,<p>Entertainment from here to the moon when Linda Eide and guests pay tribute and joke with language.</p>,1650016918
3734,https://www.tvmaze.com/shows/3734/the-streamy-awards,The Streamy Awards,Award Show,English,[],Running,90.0,108.0,2009-03-28,,http://www.streamys.org,37,"{'id': 186, 'name': 'FUSE TV', 'country': {'name': 'United States', 'code': 'US', 'timezone': 'America/New_York'}, 'officialSite': None}",,"<p><b>The Streamy Awards </b>honor the best in online video and the creators behind it. The annual event brings together the biggest names in YouTube and online video for a night of celebration, discovery, and meaningful recognition.</p>",1615235438
50594,https://www.tvmaze.com/shows/50594/cage-warriors,Cage Warriors,Sports,English,[],Running,120.0,120.0,2002-07-27,,https://cagewarriors.com,16,,,"<p><b>Cage Warriors</b> is a mixed martial arts promotion, based in London. The promotion was established in 2001 and staged its first MMA event in London in July, 2002. </p>",1648696651
