_embedded_show_id,_embedded_show_url,_embedded_show_name,_embedded_show_type,_embedded_show_language,_embedded_show_genres,_embedded_show_status,_embedded_show_runtime,_embedded_show_averageRuntime,_embedded_show_premiered,_embedded_show_ended,_embedded_show_officialSite,_embedded_show_weight,_embedded_show_webChannel,_embedded_show_dvdCountry,_embedded_show_summary,_embedded_show_updated
10892,https://www.tvmaze.com/shows/10892/troe-iz-prostokvasino,Трое из Простоквашино,Animation,Russian,"['Children', 'Family']",Running,7.0,15.0,1978-06-10,,https://okko.tv/serial/prostokvashino,41,,,,1651338648
19628,https://www.tvmaze.com/shows/19628/top-10-po-versii-seasonvarru,ТОП-10 по версии Seasonvar.ru,Talk Show,Russian,[],Running,9.0,9.0,2015-11-27,,http://seasonvar.ru/serial-12772-TOP-10_po_versii_Seasonvarru-1-season.html,28,"{'id': 56, 'name': 'Seasonvar', 'country': {'name': 'Russian Federation', 'code': 'RU', 'timezone': 'Asia/Kamchatka'}, 'officialSite': None}",,,1651181449
51471,https://www.tvmaze.com/shows/51471/hero-return,Hero Return,Animation,Chinese,"['Action', 'Anime', 'Science-Fiction']",Running,15.0,16.0,2020-10-18,,https://v.qq.com/detail/q/q72jd29a3oxflsr.html,76,"{'id': 104, 'name': 'Tencent QQ', 'country': {'name': 'China', 'code': 'CN', 'timezone': 'Asia/Shanghai'}, 'officialSite': 'https://v.qq.com/'}",,"<p>Zero was mankind's first real superhero. Under his watch, countless other superheros appeared and followed in his footsteps. However, after 5 years of war, Zero disappeared without a trace.<br /><br />(Source: zeroscans)</p>",1603467037
52178,https://www.tvmaze.com/shows/52178/swallowed-star,Swallowed Star,Animation,Chinese,"['Anime', 'Science-Fiction']",Running,,21.0,2020-11-29,,https://v.qq.com/detail/3/324olz7ilvo2j5f.html,88,"{'id': 104, 'name': 'Tencent QQ', 'country': {'name': 'China', 'code': 'CN', 'timezone': 'Asia/Shanghai'}, 'officialSite': 'https://v.qq.com/'}",,"<p>One day, an unexplained RR virus appeared on the earth, drawing the world into disaster. Infected animals mutated into terrible monsters, invaded massively, and humans built walls around the destruction and established the base city as the last bastion for humans. The suffering that mankind has experienced during this period of time is known as the ""Great Nirvana Period."" Not only that, Luo Feng not only carried the burden of supporting the family but also to protect the human homeland, for the better survival and development of mankind, together with other justice warriors, to join hands against the fierce monsters. Under the desperate situation of the end, can Luo Feng and other warriors repel monsters and successfully protect the human world?</p>",1648370962
54033,https://www.tvmaze.com/shows/54033/wu-shen-zhu-zai,Wu Shen Zhu Zai,Animation,Chinese,"['Action', 'Adventure', 'Anime', 'Fantasy']",Running,8.0,8.0,2020-03-08,,https://v.qq.com/detail/m/7q544xyrava3vxf.html,76,"{'id': 104, 'name': 'Tencent QQ', 'country': {'name': 'China', 'code': 'CN', 'timezone': 'Asia/Shanghai'}, 'officialSite': 'https://v.qq.com/'}",,"<p>The protagonist Qin Chen, who was originally the top genius in the military domain, was conspired by the people to fall into the death canyon in the forbidden land of the mainland. Qin Chen, who was inevitably dead, unexpectedly triggered the power of the mysterious ancient sword.<br /><br />Three hundred years later, in a remote part of the Tianwu mainland, a boy of the same name accidentally inherited Qin Chen's will. As the beloved grandson of King Dingwu of the Daqi National Army, due to the birth father's birth, the mother and son were treated coldly in Dingwu's palace and lived together. In order to rewrite the myth of the strong man in hope of the sun, and to protect everything he loves, Qin Chen resolutely took up the responsibility of maintaining the five kingdoms of the world and set foot on the road of martial arts again.</p>",1649423444
50398,https://www.tvmaze.com/shows/50398/mans-diary,Man's Diary,Animation,Chinese,"['Anime', 'Supernatural']",Running,12.0,12.0,2019-07-21,,https://www.bilibili.com/bangumi/media/md4314622,3,"{'id': 51, 'name': 'Bilibili', 'country': {'name': 'China', 'code': 'CN', 'timezone': 'Asia/Shanghai'}, 'officialSite': None}",,"<p>In the twenty-first century, gods and demons can no longer maintain balance due to the rapid development of human society. In an effort to restore proper order, the gods began to take care of saving the world, for which they sent a group of gods and monsters to the world of people, who must find there the "" key "" to salvation. Su moting is a girl with the personality of ""demon child"". When her parents asked her to leave home so that she could become independent and independent, she met the beautiful and charming God of Tianjin and the mysterious demon cat. So begins a new turbulent round of su moting's life.</p><p><br /> </p>",1611039497
52898,https://www.tvmaze.com/shows/52898/legend-of-yun-qian,Legend of Yun Qian,Scripted,Chinese,"['Drama', 'Romance', 'History']",Ended,4.0,4.0,2020-12-21,2020-12-31,,67,"{'id': 445, 'name': 'CTI TV', 'country': {'name': 'Taiwan, Province of China', 'code': 'TW', 'timezone': 'Asia/Taipei'}, 'officialSite': None}",,"<p>The disciples of the Lingchuan Sect have guarded the Fans of Heaven and Earth for nearly a century. Mu Yun and Hua Yue are the only disciples of the sect that are left. The stubborn and disobedient Hua Yue unintentionally discovers that the Fan of Heaven possesses the power to travel through time. To escape being forced to study and practice martial arts by Mu Yun, Hua Yue travels to the future to have fun. Hundreds of years in the future she meets Xiao Qian who looks exactly like her. Secrets come to the surface, and adventures take place.</p>",1649956202
49948,https://www.tvmaze.com/shows/49948/love-revolution,Love Revolution,Scripted,Korean,"['Drama', 'Comedy', 'Romance']",Ended,20.0,20.0,2020-09-01,2020-12-27,https://tv.kakao.com/channel/3643849/cliplink/412069527?metaObjectType=Channel,34,"{'id': 294, 'name': 'Kakao TV', 'country': {'name': 'Korea, Republic of', 'code': 'KR', 'timezone': 'Asia/Seoul'}, 'officialSite': 'https://tv.kakao.com/top'}",,"<p>The story of the ""unique romance"" about teenagers navigating love, friendship, and the chaos of high school. The story will focus mainly on Gong Joo Young, a cute and lovable student who falls in love at first sight with the standoffish and popular Wang Ja Rim. Unwavering in his love for Wang Ja Rim, the confident and cheerful Gong Joo Young isn't shy about his feelings and is determined to win her heart no matter what. However, despite his gentle, sweet nature when it comes to love, Gong Joo Young is also a steadfast, loyal friend who shows off a tougher and more mature side when his friends need his help.</p>",1609616788
49948,https://www.tvmaze.com/shows/49948/love-revolution,Love Revolution,Scripted,Korean,"['Drama', 'Comedy', 'Romance']",Ended,20.0,20.0,2020-09-01,2020-12-27,https://tv.kakao.com/channel/3643849/cliplink/412069527?metaObjectType=Channel,34,"{'id': 294, 'name': 'Kakao TV', 'country': {'name': 'Korea, Republic of', 'code': 'KR', 'timezone': 'Asia/Seoul'}, 'officialSite': 'https://tv.kakao.com/top'}",,"<p>The story of the ""unique romance"" about teenagers navigating love, friendship, and the chaos of high school. The story will focus mainly on Gong Joo Young, a cute and lovable student who falls in love at first sight with the standoffish and popular Wang Ja Rim. Unwavering in his love for Wang Ja Rim, the confident and cheerful Gong Joo Young isn't shy about his feelings and is determined to win her heart no matter what. However, despite his gentle, sweet nature when it comes to love, Gong Joo Young is also a steadfast, loyal friend who shows off a tougher and more mature side when his friends need his help.</p>",1609616788
53094,https://www.tvmaze.com/shows/53094/youtuber-class,Youtuber Class,Scripted,Korean,"['Drama', 'Romance']",Ended,11.0,13.0,2020-12-27,2021-01-17,https://m.tv.naver.com/whynottv/home,24,"{'id': 30, 'name': 'Naver TVCast', 'country': {'name': 'Korea, Republic of', 'code': 'KR', 'timezone': 'Asia/Seoul'}, 'officialSite': 'https://tv.naver.com/'}",,,1611507979
12906,https://www.tvmaze.com/shows/12906/huskestue,Huskestue,Game Show,Norwegian,['Comedy'],Running,,43.0,2015-04-08,,https://play.tv2.no/programmer/underholdning/huskestue/,70,"{'id': 327, 'name': 'TV 2 Play', 'country': {'name': 'Norway', 'code': 'NO', 'timezone': 'Europe/Oslo'}, 'officialSite': None}",,"<p>In <b>Huskestue</b>, two teams of medium-intelligent celebrities try to answer medium difficult questions. If the participants respond incorrectly, physical punishment often awaits.</p>",1651234374
49524,https://www.tvmaze.com/shows/49524/30-monedas,30 Monedas,Scripted,Spanish,"['Horror', 'Thriller', 'Mystery']",Running,60.0,64.0,2020-11-29,,https://es.hboespana.com/series/30-coins/37b0ccfe-0bf1-489e-b2a3-cae9f6307eb6,88,,,"<p>Father Vergara is an exorcist, boxer and ex-convict who is exiled by the church to be the priest of a remote town in Spain. He wants to forget and be forgotten, but his enemies will soon find him. Strange things begin to happen, and an unlikely task force of Mayor Paco and local vet Elena seek the truth, whilst reality is distorted by a cursed coin which is at the heart of a global conspiracy.  </p>",1648334894
52156,https://www.tvmaze.com/shows/52156/by-ana-milan,By Ana Milán,Scripted,Spanish,['Comedy'],Running,,,2020-11-08,,https://www.atresplayer.com/series/byanamilan/,25,"{'id': 377, 'name': 'ATRESplayer PREMIUM', 'country': {'name': 'Spain', 'code': 'ES', 'timezone': 'Europe/Madrid'}, 'officialSite': None}",,,1623611405
52545,https://www.tvmaze.com/shows/52545/fisica-o-quimica-el-reencuentro,Física o química: El reencuentro,Scripted,Spanish,['Drama'],Ended,,66.0,2020-12-27,2021-01-03,https://www.atresplayer.com/series/fisica-o-quimica-el-reencuentro/,28,"{'id': 377, 'name': 'ATRESplayer PREMIUM', 'country': {'name': 'Spain', 'code': 'ES', 'timezone': 'Europe/Madrid'}, 'officialSite': None}",,<p>The old classmates of the Zurbaran school reunite in the wake of a secret that they all kept and has greatly affected their lives.</p>,1647575077
53467,https://www.tvmaze.com/shows/53467/labyrint,Labyrint,Scripted,Norwegian,"['Comedy', 'Children']",Running,,30.0,2013-12-22,,https://tv.nrk.no/serie/labyrint,14,"{'id': 238, 'name': 'NRK TV', 'country': {'name': 'Norway', 'code': 'NO', 'timezone': 'Europe/Oslo'}, 'officialSite': None}",,"<p>In Daidalos' underwater Labyrinth, exciting tasks, scary robot creatures and slime await.</p>",1612980960
30606,https://www.tvmaze.com/shows/30606/scishow,SciShow,Documentary,English,[],Running,,9.0,2012-01-02,,https://www.youtube.com/user/scishow/,10,"{'id': 21, 'name': 'YouTube', 'country': None, 'officialSite': 'https://www.youtube.com'}",,"<p><b>SciShow</b> explores the unexpected. Seven days a week, Hank Green, Michael Aranda, and Olivia Gordon delve into the scientific subjects that defy our expectations and make us even more curious!</p><p>Schedule:</p><p>Sundays — Learn about the amazing topics we can't quite make a stand-alone show about in SciShow List Show!</p><p>Mondays — Tune in for a short Dose about our weird world.</p><p>Tuesdays — Find answers to our most asked Quick Questions.</p><p>Wednesdays — Hank or Michael dives deep into a long-form Infusion episode, or an unscripted talk show or quiz show with a guest!</p><p>Thursday — Another new dose about the wonders of the world.</p><p>Fridays — Learn the latest in science News.</p><p>Saturdays — Get your quick questions answered!</p>",1644762005
39314,https://www.tvmaze.com/shows/39314/friheden,Friheden,Scripted,Danish,"['Drama', 'Comedy', 'Crime']",Running,45.0,45.0,2018-10-24,,https://viaplay.dk/serier/friheden,73,"{'id': 103, 'name': 'Viaplay', 'country': None, 'officialSite': 'https://viaplay.com'}",,"<p>Some 20 years ago, Nina and Erik were brilliant con-artists. Now, they live a peaceful family life in the suburbs of Copenhagen, although their marriage is somewhat lackluster, and they have trouble making ends meet. One day, their partner in crime from the old days, Jacqueline, reappears with a new idea for a scam with plenty of money to be made!</p>",1621567285
42899,https://www.tvmaze.com/shows/42899/redakcia,Редакция,Talk Show,Russian,[],Running,40.0,57.0,2019-03-17,,https://www.youtube.com/channel/UC1eFXmJNkjITxPFWTy6RsWg,70,"{'id': 21, 'name': 'YouTube', 'country': None, 'officialSite': 'https://www.youtube.com'}",,"<p>The author's journalistic program of Alexey Pivovarov, where he asks questions and interviews guests, makes reports on actual themes, as well as on entertaining topics.</p>",1651749165
43141,https://www.tvmaze.com/shows/43141/bani-negri-pentru-zile-albe,Bani negri (pentru zile albe),Scripted,Romanian,['Comedy'],To Be Determined,60.0,60.0,2020-11-22,,https://hbogo.ro/seriale/bani-negri-pentru-zile-albe,44,"{'id': 22, 'name': 'HBO Go', 'country': None, 'officialSite': None}",,"<p>Features two lovable losers joking about committing the ""perfect crime."" The series revolves around the events that unfold when the joke backfires and the pair is forced to actually commit the robbery, for which they are totally unprepared.</p>",1649176744
49139,https://www.tvmaze.com/shows/49139/cuzie-pisma,Чужие письма,Talk Show,Russian,[],Running,50.0,59.0,2020-04-21,,https://www.youtube.com/channel/UC4g4YABfz_vEwmZLjtF2Zjw,2,"{'id': 21, 'name': 'YouTube', 'country': None, 'officialSite': 'https://www.youtube.com'}",,,1649572594
51398,https://www.tvmaze.com/shows/51398/lakan,Lakan,Scripted,Tagalog,"['Drama', 'Romance']",Ended,25.0,28.0,2020-10-26,2021-03-01,https://www.youtube.com/channel/UC55Yhi0p2HMQl7wljpwOmog/,27,"{'id': 21, 'name': 'YouTube', 'country': None, 'officialSite': 'https://www.youtube.com'}",,<p><b>Lakan</b> is about a man who wants to escape the reality of his life where he can rest from the hardships of the city and feel the simplicity of life and a man from the province who has a great responsibility to their tribe. The two form an intimate relationship without knowing that it is love despite their sexual preferences.</p>,1650949116
52148,https://www.tvmaze.com/shows/52148/ultra-galaxy-fight-the-absolute-conspiracy,Ultra Galaxy Fight: The Absolute Conspiracy,Scripted,Japanese,"['Action', 'Science-Fiction']",Ended,12.0,12.0,2020-11-22,2021-01-31,http://m-78.jp/galaxy-fight/tac/,15,"{'id': 21, 'name': 'YouTube', 'country': None, 'officialSite': 'https://www.youtube.com'}",,"<p>The eagerly awaited new entry to the Ultra Galaxy Fight series will be released on YouTube! With ten episodes adding up to about ninety minutes in total, Ultra Galaxy Fight: The Absolute Conspiracy will be packed with profound drama and exciting action!</p><p>Mysterious aliens and evil monsters that shouldn't exist are attacking!<br />Zero, Ribut, Taiga, Z (Zett), 80, Max, Mebius, Great, Powered, Grigio, and many more Ultra Heroes fight together to solve this mysterious case, which could end up affecting the whole universe. However, this is only the beginning! A conspiracy is underway – and stories are intersecting. What is the aim of the golden giant working in the shadows?!</p><p>While connecting to the TV series Ultraman Z as well, a new history of Ultraman begins!</p>",1612060922
52303,https://www.tvmaze.com/shows/52303/pappas-pojkar,Pappas pojkar,Scripted,Swedish,['Comedy'],Running,22.0,22.0,2020-12-06,,https://www.discoveryplus.se/program/pappas-pojkar,27,"{'id': 173, 'name': 'discovery+', 'country': None, 'officialSite': 'https://www.discoveryplus.com/'}",,"<p>Once they were the coolest guys in school. Ten years later, they are still partying as if they were carefree teenagers. Now it's high time for daddy's boys to grow up.</p>",1626429264
52653,https://www.tvmaze.com/shows/52653/outlier,Outlier,Scripted,Norwegian,"['Drama', 'Crime', 'Thriller']",Ended,,43.0,2020-12-27,2020-12-27,https://hbonordic.com/series/outlier/b6fcd668-52c9-4200-a80f-e1fb829ebe7d,75,"{'id': 330, 'name': 'HBO Nordic', 'country': None, 'officialSite': None}",,"<p>In the middle of the night, far north in Norway at Finnmarksvidda, the Sami teenager Elle Jannok is on her way home from a party, when she finds a cell phone ringing. The phone belongs to a missing girl, Sofie. A couple of days later, the local police discover Sofie's body in a caravan three hours south of Finnmark.</p><p>Maja Angell, who is studying at the University of London, is defending her highly debated doctoral thesis on criminology &amp; profiling as she hears about the murder case in her old home town in Northern Norway. She defies all warnings and leaves the University to travel North. She has a message for the local police: the man charged with the murder, is not the killer. But no one's willing to listen to her theories. Not until Maja dares to delve into her own most dangerous, repressed memories of childhood will she be able to stop him and soon she realize that the killer is closer than she ever imagined.</p>",1614642259
52653,https://www.tvmaze.com/shows/52653/outlier,Outlier,Scripted,Norwegian,"['Drama', 'Crime', 'Thriller']",Ended,,43.0,2020-12-27,2020-12-27,https://hbonordic.com/series/outlier/b6fcd668-52c9-4200-a80f-e1fb829ebe7d,75,"{'id': 330, 'name': 'HBO Nordic', 'country': None, 'officialSite': None}",,"<p>In the middle of the night, far north in Norway at Finnmarksvidda, the Sami teenager Elle Jannok is on her way home from a party, when she finds a cell phone ringing. The phone belongs to a missing girl, Sofie. A couple of days later, the local police discover Sofie's body in a caravan three hours south of Finnmark.</p><p>Maja Angell, who is studying at the University of London, is defending her highly debated doctoral thesis on criminology &amp; profiling as she hears about the murder case in her old home town in Northern Norway. She defies all warnings and leaves the University to travel North. She has a message for the local police: the man charged with the murder, is not the killer. But no one's willing to listen to her theories. Not until Maja dares to delve into her own most dangerous, repressed memories of childhood will she be able to stop him and soon she realize that the killer is closer than she ever imagined.</p>",1614642259
52653,https://www.tvmaze.com/shows/52653/outlier,Outlier,Scripted,Norwegian,"['Drama', 'Crime', 'Thriller']",Ended,,43.0,2020-12-27,2020-12-27,https://hbonordic.com/series/outlier/b6fcd668-52c9-4200-a80f-e1fb829ebe7d,75,"{'id': 330, 'name': 'HBO Nordic', 'country': None, 'officialSite': None}",,"<p>In the middle of the night, far north in Norway at Finnmarksvidda, the Sami teenager Elle Jannok is on her way home from a party, when she finds a cell phone ringing. The phone belongs to a missing girl, Sofie. A couple of days later, the local police discover Sofie's body in a caravan three hours south of Finnmark.</p><p>Maja Angell, who is studying at the University of London, is defending her highly debated doctoral thesis on criminology &amp; profiling as she hears about the murder case in her old home town in Northern Norway. She defies all warnings and leaves the University to travel North. She has a message for the local police: the man charged with the murder, is not the killer. But no one's willing to listen to her theories. Not until Maja dares to delve into her own most dangerous, repressed memories of childhood will she be able to stop him and soon she realize that the killer is closer than she ever imagined.</p>",1614642259
52653,https://www.tvmaze.com/shows/52653/outlier,Outlier,Scripted,Norwegian,"['Drama', 'Crime', 'Thriller']",Ended,,43.0,2020-12-27,2020-12-27,https://hbonordic.com/series/outlier/b6fcd668-52c9-4200-a80f-e1fb829ebe7d,75,"{'id': 330, 'name': 'HBO Nordic', 'country': None, 'officialSite': None}",,"<p>In the middle of the night, far north in Norway at Finnmarksvidda, the Sami teenager Elle Jannok is on her way home from a party, when she finds a cell phone ringing. The phone belongs to a missing girl, Sofie. A couple of days later, the local police discover Sofie's body in a caravan three hours south of Finnmark.</p><p>Maja Angell, who is studying at the University of London, is defending her highly debated doctoral thesis on criminology &amp; profiling as she hears about the murder case in her old home town in Northern Norway. She defies all warnings and leaves the University to travel North. She has a message for the local police: the man charged with the murder, is not the killer. But no one's willing to listen to her theories. Not until Maja dares to delve into her own most dangerous, repressed memories of childhood will she be able to stop him and soon she realize that the killer is closer than she ever imagined.</p>",1614642259
52653,https://www.tvmaze.com/shows/52653/outlier,Outlier,Scripted,Norwegian,"['Drama', 'Crime', 'Thriller']",Ended,,43.0,2020-12-27,2020-12-27,https://hbonordic.com/series/outlier/b6fcd668-52c9-4200-a80f-e1fb829ebe7d,75,"{'id': 330, 'name': 'HBO Nordic', 'country': None, 'officialSite': None}",,"<p>In the middle of the night, far north in Norway at Finnmarksvidda, the Sami teenager Elle Jannok is on her way home from a party, when she finds a cell phone ringing. The phone belongs to a missing girl, Sofie. A couple of days later, the local police discover Sofie's body in a caravan three hours south of Finnmark.</p><p>Maja Angell, who is studying at the University of London, is defending her highly debated doctoral thesis on criminology &amp; profiling as she hears about the murder case in her old home town in Northern Norway. She defies all warnings and leaves the University to travel North. She has a message for the local police: the man charged with the murder, is not the killer. But no one's willing to listen to her theories. Not until Maja dares to delve into her own most dangerous, repressed memories of childhood will she be able to stop him and soon she realize that the killer is closer than she ever imagined.</p>",1614642259
52653,https://www.tvmaze.com/shows/52653/outlier,Outlier,Scripted,Norwegian,"['Drama', 'Crime', 'Thriller']",Ended,,43.0,2020-12-27,2020-12-27,https://hbonordic.com/series/outlier/b6fcd668-52c9-4200-a80f-e1fb829ebe7d,75,"{'id': 330, 'name': 'HBO Nordic', 'country': None, 'officialSite': None}",,"<p>In the middle of the night, far north in Norway at Finnmarksvidda, the Sami teenager Elle Jannok is on her way home from a party, when she finds a cell phone ringing. The phone belongs to a missing girl, Sofie. A couple of days later, the local police discover Sofie's body in a caravan three hours south of Finnmark.</p><p>Maja Angell, who is studying at the University of London, is defending her highly debated doctoral thesis on criminology &amp; profiling as she hears about the murder case in her old home town in Northern Norway. She defies all warnings and leaves the University to travel North. She has a message for the local police: the man charged with the murder, is not the killer. But no one's willing to listen to her theories. Not until Maja dares to delve into her own most dangerous, repressed memories of childhood will she be able to stop him and soon she realize that the killer is closer than she ever imagined.</p>",1614642259
52653,https://www.tvmaze.com/shows/52653/outlier,Outlier,Scripted,Norwegian,"['Drama', 'Crime', 'Thriller']",Ended,,43.0,2020-12-27,2020-12-27,https://hbonordic.com/series/outlier/b6fcd668-52c9-4200-a80f-e1fb829ebe7d,75,"{'id': 330, 'name': 'HBO Nordic', 'country': None, 'officialSite': None}",,"<p>In the middle of the night, far north in Norway at Finnmarksvidda, the Sami teenager Elle Jannok is on her way home from a party, when she finds a cell phone ringing. The phone belongs to a missing girl, Sofie. A couple of days later, the local police discover Sofie's body in a caravan three hours south of Finnmark.</p><p>Maja Angell, who is studying at the University of London, is defending her highly debated doctoral thesis on criminology &amp; profiling as she hears about the murder case in her old home town in Northern Norway. She defies all warnings and leaves the University to travel North. She has a message for the local police: the man charged with the murder, is not the killer. But no one's willing to listen to her theories. Not until Maja dares to delve into her own most dangerous, repressed memories of childhood will she be able to stop him and soon she realize that the killer is closer than she ever imagined.</p>",1614642259
52653,https://www.tvmaze.com/shows/52653/outlier,Outlier,Scripted,Norwegian,"['Drama', 'Crime', 'Thriller']",Ended,,43.0,2020-12-27,2020-12-27,https://hbonordic.com/series/outlier/b6fcd668-52c9-4200-a80f-e1fb829ebe7d,75,"{'id': 330, 'name': 'HBO Nordic', 'country': None, 'officialSite': None}",,"<p>In the middle of the night, far north in Norway at Finnmarksvidda, the Sami teenager Elle Jannok is on her way home from a party, when she finds a cell phone ringing. The phone belongs to a missing girl, Sofie. A couple of days later, the local police discover Sofie's body in a caravan three hours south of Finnmark.</p><p>Maja Angell, who is studying at the University of London, is defending her highly debated doctoral thesis on criminology &amp; profiling as she hears about the murder case in her old home town in Northern Norway. She defies all warnings and leaves the University to travel North. She has a message for the local police: the man charged with the murder, is not the killer. But no one's willing to listen to her theories. Not until Maja dares to delve into her own most dangerous, repressed memories of childhood will she be able to stop him and soon she realize that the killer is closer than she ever imagined.</p>",1614642259
