_embedded_show_id,_embedded_show_url,_embedded_show_name,_embedded_show_type,_embedded_show_language,_embedded_show_genres,_embedded_show_status,_embedded_show_runtime,_embedded_show_averageRuntime,_embedded_show_premiered,_embedded_show_ended,_embedded_show_officialSite,_embedded_show_weight,_embedded_show_network,_embedded_show_dvdCountry,_embedded_show_summary,_embedded_show_updated
52104,https://www.tvmaze.com/shows/52104/twisted-fate-of-love,Twisted Fate of Love,Scripted,Chinese,"['Drama', 'Romance', 'History']",Ended,45.0,45.0,2020-11-23,2020-12-30,https://v.qq.com/x/search/?q=+%E4%BB%8A%E5%A4%95%E4%BD%95%E5%A4%95&stag=0&smartbox_ab=,27,,,"<p>During the Yin Dynasty, Dong Yue, a brave general in the Dingyuan Rebellion, was sent back in time to stop a war that would claim the lives of countless innocents. She sets out to murder corrupted officer Lu Yuantong in an attempt to prevent war, and during her journey she met Feng Xi and Pang Yu. Pang Yu and Feng Xi were old friends who cared deeply for each other, but fell out and turn into enemies. While trying to reconcile the two brothers, Dong Yue also tries to stop Lu Yuantang's evil schemes which are poised to tear the nation apart with their help.</p>",1609535141
52107,https://www.tvmaze.com/shows/52107/new-face,New Face,Scripted,Chinese,"['Action', 'Crime', 'Thriller']",Running,45.0,45.0,2020-11-24,,https://v.qq.com/detail/m/mzc00200tu76tos.html,18,,,"<p>Pan, a desolate plastic surgeon, lived a repetitive and boring life every day until a conspiracy happened. He woke up in an abandoned factory, and found that someone had replaced his identity with a face exactly like him. His world has been completely overturned and left in a perilous situation. Can he overcome the difficulties and peel away the truth? How would he regain his identity?</p>",1606418164
52107,https://www.tvmaze.com/shows/52107/new-face,New Face,Scripted,Chinese,"['Action', 'Crime', 'Thriller']",Running,45.0,45.0,2020-11-24,,https://v.qq.com/detail/m/mzc00200tu76tos.html,18,,,"<p>Pan, a desolate plastic surgeon, lived a repetitive and boring life every day until a conspiracy happened. He woke up in an abandoned factory, and found that someone had replaced his identity with a face exactly like him. His world has been completely overturned and left in a perilous situation. Can he overcome the difficulties and peel away the truth? How would he regain his identity?</p>",1606418164
52108,https://www.tvmaze.com/shows/52108/psych-hunter,Psych Hunter,Scripted,Chinese,"['Drama', 'Thriller', 'Mystery']",Ended,45.0,45.0,2020-11-23,2020-12-16,https://www.iqiyi.com/a_19rrhskr95.html,32,,,"<p>Merchant Jiang Shuo and his odd specialist companion Qin Yi Heng purchase frequented houses to exchange them. In any case, alarming things start to occur and each spooky house is by all accounts part of a major riddle. Jiang Shuo, Yi Heng, and police officer Yuan Mu Qing attempt to understand the riddle.</p>",1650826480
52108,https://www.tvmaze.com/shows/52108/psych-hunter,Psych Hunter,Scripted,Chinese,"['Drama', 'Thriller', 'Mystery']",Ended,45.0,45.0,2020-11-23,2020-12-16,https://www.iqiyi.com/a_19rrhskr95.html,32,,,"<p>Merchant Jiang Shuo and his odd specialist companion Qin Yi Heng purchase frequented houses to exchange them. In any case, alarming things start to occur and each spooky house is by all accounts part of a major riddle. Jiang Shuo, Yi Heng, and police officer Yuan Mu Qing attempt to understand the riddle.</p>",1650826480
52113,https://www.tvmaze.com/shows/52113/maryland-farm-harvest,Maryland Farm & Harvest,Documentary,English,"['Food', 'Nature']",Running,27.0,27.0,2013-11-19,,https://www.mpt.org/programs/farm/,13,"{'id': 85, 'name': 'PBS', 'country': {'name': 'United States', 'code': 'US', 'timezone': 'America/New_York'}, 'officialSite': None}",,<p>A series exploring the history of farming and agriculture in Maryland. </p>,1637630568
52150,https://www.tvmaze.com/shows/52150/cheat,Cheat,Scripted,Tagalog,"['Drama', 'Romance', 'Supernatural']",Running,20.0,26.0,2020-12-01,,https://www.youtube.com/watch?v=Hw4Yugat0LM&t=6s,25,,,"<p><b>Cheat</b> revolves around five main young characters; an innocent young man, Vee, who has had an unusual sheltered upbringing. Vee lives with his full-time guardian, an apostolic nun. The series concerns the effect that Vee has on 3 siblings: Dong, Jennifer, and Jay. The siblings live with their mother who dabbles in witchcraft. Their father, who is never seen, left the family to be with his Mistress who makes up the eighth character in the entire series.</p>",1641973457
52159,https://www.tvmaze.com/shows/52159/to-love,To Love,Scripted,Chinese,"['Crime', 'Thriller', 'Mystery']",Ended,45.0,45.0,2020-11-19,2020-12-23,https://so.youku.com/search_video/q_%20%E6%9C%80%E5%88%9D%E7%9A%84%E7%9B%B8%E9%81%87?searchfrom=1,25,,,"<p>A story that follows people whose lives are entangled due to a complicated case. While investigating a drug cartel as an undercover cop, Yan Jin falls in love with the beautiful coffee shop owner Ji Xiao'ou.</p>",1609060726
52159,https://www.tvmaze.com/shows/52159/to-love,To Love,Scripted,Chinese,"['Crime', 'Thriller', 'Mystery']",Ended,45.0,45.0,2020-11-19,2020-12-23,https://so.youku.com/search_video/q_%20%E6%9C%80%E5%88%9D%E7%9A%84%E7%9B%B8%E9%81%87?searchfrom=1,25,,,"<p>A story that follows people whose lives are entangled due to a complicated case. While investigating a drug cartel as an undercover cop, Yan Jin falls in love with the beautiful coffee shop owner Ji Xiao'ou.</p>",1609060726
52191,https://www.tvmaze.com/shows/52191/wayward-guide,Wayward Guide,Scripted,English,"['Comedy', 'Fantasy', 'Mystery']",Ended,,11.0,2020-10-13,2020-12-15,https://www.youtube.com/playlist?list=PLlF0gFzOX4tA4l7X4UiwwD9x9JRgEkMdO,35,,,"<p>After podcast host, Artemis, and her twin brother, Paul, uncover a secret race of werewolves, they must decide who to trust and the price they're willing to pay for a juicy story.</p>",1632084363
52400,https://www.tvmaze.com/shows/52400/dream-detective,Dream Detective,Scripted,Chinese,"['Drama', 'Fantasy', 'Mystery']",Ended,45.0,45.0,2020-12-08,2021-01-05,https://v.qq.com/detail/m/mzc00200ur8p8zp.html,18,,,"<p>Two unlikely individuals join forces to find the truth behind a series of murders using an unconventional method. Chen Si, a female detective with a sense of justice, unexpectedly becomess partners with Yuan Shuai, a dream interpreter with a dark past.</p>",1612842583
52400,https://www.tvmaze.com/shows/52400/dream-detective,Dream Detective,Scripted,Chinese,"['Drama', 'Fantasy', 'Mystery']",Ended,45.0,45.0,2020-12-08,2021-01-05,https://v.qq.com/detail/m/mzc00200ur8p8zp.html,18,,,"<p>Two unlikely individuals join forces to find the truth behind a series of murders using an unconventional method. Chen Si, a female detective with a sense of justice, unexpectedly becomess partners with Yuan Shuai, a dream interpreter with a dark past.</p>",1612842583
52400,https://www.tvmaze.com/shows/52400/dream-detective,Dream Detective,Scripted,Chinese,"['Drama', 'Fantasy', 'Mystery']",Ended,45.0,45.0,2020-12-08,2021-01-05,https://v.qq.com/detail/m/mzc00200ur8p8zp.html,18,,,"<p>Two unlikely individuals join forces to find the truth behind a series of murders using an unconventional method. Chen Si, a female detective with a sense of justice, unexpectedly becomess partners with Yuan Shuai, a dream interpreter with a dark past.</p>",1612842583
52400,https://www.tvmaze.com/shows/52400/dream-detective,Dream Detective,Scripted,Chinese,"['Drama', 'Fantasy', 'Mystery']",Ended,45.0,45.0,2020-12-08,2021-01-05,https://v.qq.com/detail/m/mzc00200ur8p8zp.html,18,,,"<p>Two unlikely individuals join forces to find the truth behind a series of murders using an unconventional method. Chen Si, a female detective with a sense of justice, unexpectedly becomess partners with Yuan Shuai, a dream interpreter with a dark past.</p>",1612842583
52400,https://www.tvmaze.com/shows/52400/dream-detective,Dream Detective,Scripted,Chinese,"['Drama', 'Fantasy', 'Mystery']",Ended,45.0,45.0,2020-12-08,2021-01-05,https://v.qq.com/detail/m/mzc00200ur8p8zp.html,18,,,"<p>Two unlikely individuals join forces to find the truth behind a series of murders using an unconventional method. Chen Si, a female detective with a sense of justice, unexpectedly becomess partners with Yuan Shuai, a dream interpreter with a dark past.</p>",1612842583
52400,https://www.tvmaze.com/shows/52400/dream-detective,Dream Detective,Scripted,Chinese,"['Drama', 'Fantasy', 'Mystery']",Ended,45.0,45.0,2020-12-08,2021-01-05,https://v.qq.com/detail/m/mzc00200ur8p8zp.html,18,,,"<p>Two unlikely individuals join forces to find the truth behind a series of murders using an unconventional method. Chen Si, a female detective with a sense of justice, unexpectedly becomess partners with Yuan Shuai, a dream interpreter with a dark past.</p>",1612842583
52400,https://www.tvmaze.com/shows/52400/dream-detective,Dream Detective,Scripted,Chinese,"['Drama', 'Fantasy', 'Mystery']",Ended,45.0,45.0,2020-12-08,2021-01-05,https://v.qq.com/detail/m/mzc00200ur8p8zp.html,18,,,"<p>Two unlikely individuals join forces to find the truth behind a series of murders using an unconventional method. Chen Si, a female detective with a sense of justice, unexpectedly becomess partners with Yuan Shuai, a dream interpreter with a dark past.</p>",1612842583
52400,https://www.tvmaze.com/shows/52400/dream-detective,Dream Detective,Scripted,Chinese,"['Drama', 'Fantasy', 'Mystery']",Ended,45.0,45.0,2020-12-08,2021-01-05,https://v.qq.com/detail/m/mzc00200ur8p8zp.html,18,,,"<p>Two unlikely individuals join forces to find the truth behind a series of murders using an unconventional method. Chen Si, a female detective with a sense of justice, unexpectedly becomess partners with Yuan Shuai, a dream interpreter with a dark past.</p>",1612842583
52534,https://www.tvmaze.com/shows/52534/nwa-shockwave,NWA Shockwave,Sports,English,[],Running,45.0,45.0,2020-12-01,,,15,,,<p>The continuation of NWA Powwerr.</p>,1608352967
53338,https://www.tvmaze.com/shows/53338/el-anesa-farah,El Anesa Farah,Scripted,Arabic,"['Drama', 'Comedy']",Ended,40.0,40.0,2019-12-29,2021-11-28,https://shahid.mbc.net/en/series/Al-Anisa-Farah/series-393634,8,,,"<p>Farah and Shadi are left to deal with the consequences of their son's kidnapping. Between war and peace, Majed and Dalal rediscover their relationship.</p>",1645039616
54112,https://www.tvmaze.com/shows/54112/kids-teaching-idol,Kids Teaching Idol,Variety,Korean,"['Comedy', 'Children', 'Music']",Ended,15.0,16.0,2020-11-24,2020-12-04,https://www.youtube.com/playlist?list=PL6NUNGdv0v-H_oolkfXq_QQunR26qgNO1,15,,,"<p>‘Personal Talent LEVEL UP' is a project by the K-Pop group ATEEZ, who will learn knew things from child prodigies. <br /> </p>",1633628529
54789,https://www.tvmaze.com/shows/54789/top-dog-fighting-championship,Top Dog Fighting Championship,Sports,Russian,['Sports'],Running,20.0,30.0,2020-01-11,,https://youtube.com/c/TopDogFC/featured,53,,,,1648290263
58367,https://www.tvmaze.com/shows/58367/struggle-meals,Struggle Meals,Scripted,,[],Running,20.0,20.0,2020-12-07,,,29,,,"<p>The struggle is real, but it doesn't mean your food has to suffer. Chef Frankie Celenza shows you how to make delicious meals for under $2 a plate.</p><p> </p>",1645718781
59555,https://www.tvmaze.com/shows/59555/scishow-kids,SciShow Kids,Scripted,English,[],Running,5.0,5.0,2015-03-09,,https://www.youtube.com/user/scishowkids,22,,,"<p><b>SciShow Kids</b> explores all those curious topics that make us ask ""why?"" Whether conducting experiments, researching new questions, or talking with experts, there's always something new to discover with SciShow Kids, no matter what your age!</p>",1639852705
59676,https://www.tvmaze.com/shows/59676/no-more-jockeys,No More Jockeys,Game Show,English,[],Running,30.0,28.0,2020-06-19,,https://www.youtube.com/c/NoMoreJockeys/,8,,,"<p><b>No More Jockeys</b> is a game created by Alex Horne, Tim Key and Mark Watson. Name a person, and a category they fall under – while avoiding naming people from all previous categories.</p>",1640944574
60809,https://www.tvmaze.com/shows/60809/discover-destination-ua,Discover Destination UA,Documentary,English,['Travel'],To Be Determined,25.0,23.0,2019-09-17,,https://destination-ua.com/,1,,,"<p>Destination UA is the project showing Ukraine from foreigner's perspective.</p><p>In First season we spent 30 days traveling along the tourist route called Golden Triangle – Kyiv-Lviv-Odesa.</p><p>We've visited more than 100 locations, tried over two dozen unique Ukrainian dishes, filmed ancient history places and modern spots. We had a lot of fun.</p><p>In the second season of the show we are visited next regions: Kyiv, Chernihiv, Sumy, Kharkiv, Poltava, Dnipro, Kherson, Mykolaiv, Vinnytsia, Zhytomyr.</p><p>Next 100 locations, interesting facts, adventures are waiting for you.</p>",1649680350
61755,https://www.tvmaze.com/shows/61755/bride-of-beirut,Bride of Beirut,Scripted,Arabic,"['Drama', 'Romance']",Running,45.0,,2019-09-01,,https://shahid.mbc.net/en/series/Arous%20Beirut-season-1/season-376514-376515,6,,,"<p>Living with her aunt, kind-hearted Thourayya leads a simple life, but her world is upended when she crosses paths with the handsome and ambitious Fares.</p>",1650908800
60785,https://www.tvmaze.com/shows/60785/kono-koi-atatamemasu-ka,Kono Koi Atatamemasu ka,Scripted,Japanese,"['Drama', 'Food', 'Romance']",Ended,57.0,59.0,2020-10-20,2020-12-22,https://www.tbs.co.jp/koiata_tbs/,15,"{'id': 159, 'name': 'TBS', 'country': {'name': 'Japan', 'code': 'JP', 'timezone': 'Asia/Tokyo'}, 'officialSite': None}",,"<p>Kiki Inoue works part-time at a convenience store, spending the better part of her day lazing about or reviewing sweets on her social media account. One day at work, she is introduced to the chain's CEO, Takumi Asaba, who, as it turns out, is familiar with Inoue's online reviews. Asaba asks Inoue to develop new desserts to sell chain-wide. As CEO, Asaba is tasked with turning around the chain's fortunes, as it is now ranked the lowest among its competitors. Close collaboration leads Inoue and Asaba to become sweet on each other.</p>",1650215851
6441,https://www.tvmaze.com/shows/6441/nfl-films-presents,NFL Films Presents,Sports,English,[],Running,30.0,30.0,1999-08-23,,http://www.nfl.com/videos/nfl-films-presents,26,"{'id': 205, 'name': 'NFL Network', 'country': {'name': 'United States', 'code': 'US', 'timezone': 'America/New_York'}, 'officialSite': None}",,"<p><b>NFL Films Presents</b> is devoted to producing commercials, television programs, feature films, and documentaries on the National Football League, as well as other unrelated major events and awards shows. It is currently owned by the NFL and produces most of its videotaped content except its live game coverage, which is handled separately by the individual networks.""</p>",1651026392
36813,https://www.tvmaze.com/shows/36813/conversa-com-bial,Conversa com Bial,Talk Show,Portuguese,[],Running,,40.0,2017-05-03,,https://globoplay.globo.com/conversa-com-bial/p/10086/,1,"{'id': 374, 'name': 'TV Globo', 'country': {'name': 'Brazil', 'code': 'BR', 'timezone': 'America/Noronha'}, 'officialSite': None}",,,1648342248
61530,https://www.tvmaze.com/shows/61530/toki-wo-kakeru-bando,Toki wo Kakeru Bando,Scripted,Japanese,"['Comedy', 'Music', 'Science-Fiction']",Ended,27.0,26.0,2020-10-20,2020-12-22,https://www.fujitv.co.jp/tokikake/,0,"{'id': 1354, 'name': 'Fuji TV TWO', 'country': {'name': 'Japan', 'code': 'JP', 'timezone': 'Asia/Tokyo'}, 'officialSite': None}","{'name': 'Japan', 'code': 'JP', 'timezone': 'Asia/Tokyo'}","<p>A story about Ryo, a mysterious and self-proclaimed music producer from the future, producing a girl band of three girls and leading them to stardom. A comical and tempo conversational drama, and various trials to produce the youth of young people who play music with comedy touch.</p>",1649705311
17633,https://www.tvmaze.com/shows/17633/all-about-android,All About Android,News,English,[],Running,90.0,90.0,2011-03-29,,https://twit.tv/shows/all-about-android,30,,,"<p><b>All About Android </b>delivers everything you want to know about Android each week -- the biggest news, freshest hardware, best apps and geekiest how-to's -- with Android enthusiasts Jason Howell, Florence Ion, Ron Richards, and a variety of special guests along the way.</p>",1650312076
38339,https://www.tvmaze.com/shows/38339/a-teacher,A Teacher,Scripted,English,['Drama'],Ended,,27.0,2020-11-10,2020-12-29,https://www.hulu.com/series/a-teacher-1c871218-05b1-4c66-a22f-260b2cb9bbf9,91,,,"<p><b>A Teacher</b> examines the complexities and consequences of an illegal relationship between a female teacher, Claire and her male high school student, Eric. Dissatisfied in their own lives, Claire and Eric discover an undeniable escape in each other, but their relationship accelerates faster than anticipated and the permanent damage becomes impossible to ignore.</p>",1637344861
45812,https://www.tvmaze.com/shows/45812/tooning-out-the-news,Tooning Out the News,Animation,English,['Comedy'],Running,,13.0,2020-04-07,,https://www.paramountplus.com/shows/tooning-out-the-news/,43,,,"<p><b>Tooning Out the News</b> will provide short daily segments leading up to a weekly full episodes featuring a cast of animated characters mocking news of the day, and interviewing real-world guests and newsmakers.</p>",1636747761
50661,https://www.tvmaze.com/shows/50661/i-was-a-teenage-felon,I Was a Teenage Felon,Documentary,English,['Crime'],Running,60.0,60.0,2020-09-22,,https://video.vice.com/en_us/show/i-was-a-teenage-felon,41,"{'id': 1006, 'name': 'Vice TV', 'country': {'name': 'United States', 'code': 'US', 'timezone': 'America/New_York'}, 'officialSite': None}",,<p>Former criminals tell the true tales of their rollercoaster ride from average American kids to wildly successful outlaws.</p>,1637762524
2504,https://www.tvmaze.com/shows/2504/goede-tijden-slechte-tijden,"Goede Tijden, Slechte Tijden",Scripted,Dutch,"['Drama', 'Romance']",Running,23.0,25.0,1990-10-01,,http://gtst.nl/#!/,77,"{'id': 112, 'name': 'RTL4', 'country': {'name': 'Netherlands', 'code': 'NL', 'timezone': 'Europe/Amsterdam'}, 'officialSite': None}",,,1651838647
50106,https://www.tvmaze.com/shows/50106/cheyenne-et-lola,Cheyenne et Lola,Scripted,French,"['Drama', 'Comedy', 'Crime']",Running,50.0,50.0,2020-11-24,,https://go.ocs.fr/details/serie/PSCHEYENNEEW0168259,40,"{'id': 432, 'name': 'OCS Max', 'country': {'name': 'France', 'code': 'FR', 'timezone': 'Europe/Paris'}, 'officialSite': None}",,"<p>Cheyenne has been out of jail for six months now, working as a cleaner on the ferries whilst dreaming about traveling to the Amazon. Lola is a beautiful Parisian woman, selfish and ruthless, who has just arrived in the north of France to move in with her lover. But when Cheyenne witnesses Lola killing her lover's wife, she knows she's going to be accused of the crime because of her criminal past.</p>",1644650582
50106,https://www.tvmaze.com/shows/50106/cheyenne-et-lola,Cheyenne et Lola,Scripted,French,"['Drama', 'Comedy', 'Crime']",Running,50.0,50.0,2020-11-24,,https://go.ocs.fr/details/serie/PSCHEYENNEEW0168259,40,"{'id': 432, 'name': 'OCS Max', 'country': {'name': 'France', 'code': 'FR', 'timezone': 'Europe/Paris'}, 'officialSite': None}",,"<p>Cheyenne has been out of jail for six months now, working as a cleaner on the ferries whilst dreaming about traveling to the Amazon. Lola is a beautiful Parisian woman, selfish and ruthless, who has just arrived in the north of France to move in with her lover. But when Cheyenne witnesses Lola killing her lover's wife, she knows she's going to be accused of the crime because of her criminal past.</p>",1644650582
32087,https://www.tvmaze.com/shows/32087/chicken-girls,Chicken Girls,Scripted,English,"['Drama', 'Children', 'Music']",Running,,14.0,2017-09-05,,https://www.youtube.com/playlist?list=PLVewHiZp3_LPhqzbcZFmS3iuDm9HymTsy,81,,,"<p>Rhyme and her friends — known by their 'ship name, ""The Chicken Girls"" — have been dancing together forever. But this year, everything's changing...</p>",1650395213
