id,url,name,season,number,type,airdate,airtime,airstamp,runtime,rating,image,summary,_links,_embedded
2165931,https://www.tvmaze.com/episodes/2165931/off-topic-2020-12-20-the-official-theme-park-crew-262,The Official Theme Park Crew - #262,2020,48.0,regular,2020-12-20,,2020-12-20T17:00:00+00:00,120.0,{'average': None},,,{'self': {'href': 'https://api.tvmaze.com/episodes/2165931'}},"{'show': {'id': 18752, 'url': 'https://www.tvmaze.com/shows/18752/off-topic', 'name': 'Off Topic', 'type': 'Talk Show', 'language': 'English', 'genres': ['Comedy'], 'status': 'Running', 'runtime': 120, 'averageRuntime': 120, 'premiered': '2015-12-06', 'ended': None, 'officialSite': 'https://roosterteeth.com/series/off-topic-the-achievement-hunter-podcast', 'schedule': {'time': '', 'days': ['Sunday']}, 'rating': {'average': None}, 'weight': 39, 'network': None, 'webChannel': {'id': 32, 'name': 'Rooster Teeth', 'country': {'name': 'United States', 'code': 'US', 'timezone': 'America/New_York'}, 'officialSite': None}, 'dvdCountry': None, 'externals': {'tvrage': None, 'thetvdb': 310336, 'imdb': 'tt6468694'}, 'image': {'medium': 'https://static.tvmaze.com/uploads/images/medium_portrait/64/161570.jpg', 'original': 'https://static.tvmaze.com/uploads/images/original_untouched/64/161570.jpg'}, 'summary': '<p>The lads and lasses of Achievement Hunter congregate each week to discuss the important questions in life. Plus drink beer.</p>', 'updated': 1631187730, '_links': {'self': {'href': 'https://api.tvmaze.com/shows/18752'}, 'previousepisode': {'href': 'https://api.tvmaze.com/episodes/2165968'}}}}"
1989023,https://www.tvmaze.com/episodes/1989023/idolish7-2x14-trigger,Trigger,2,14.0,regular,2020-12-20,,2020-12-20T17:00:00+00:00,25.0,{'average': None},,"<p>Tamaki and Aya are finally reunited. Tamaki wants the two of them to live together, but Aya informs him that she wants to remain with her new father who has been taking care of her. A surprising figure appears before the dumbfounded group. When they learn of his ambition, IDOLiSH7's feelings are united--</p>",{'self': {'href': 'https://api.tvmaze.com/episodes/1989023'}},"{'show': {'id': 33463, 'url': 'https://www.tvmaze.com/shows/33463/idolish7', 'name': 'IDOLiSH7', 'type': 'Animation', 'language': 'Japanese', 'genres': ['Anime', 'Music'], 'status': 'Running', 'runtime': 25, 'averageRuntime': 25, 'premiered': '2017-11-02', 'ended': None, 'officialSite': 'http://idolish7.com/aninana/', 'schedule': {'time': '22:30', 'days': ['Sunday']}, 'rating': {'average': None}, 'weight': 29, 'network': {'id': 132, 'name': 'Tokyo MX', 'country': {'name': 'Japan', 'code': 'JP', 'timezone': 'Asia/Tokyo'}, 'officialSite': None}, 'webChannel': None, 'dvdCountry': None, 'externals': {'tvrage': None, 'thetvdb': 337336, 'imdb': None}, 'image': {'medium': 'https://static.tvmaze.com/uploads/images/medium_portrait/295/737516.jpg', 'original': 'https://static.tvmaze.com/uploads/images/original_untouched/295/737516.jpg'}, 'summary': ""<p>A group of aspiring idols gather at Takanashi Productions and are entrusted with the company's future. The seven men who have just met represent a variety of totally different personalities. However, they each have their own charm and possess unknown potential as idols. Forming a group, they take their first step together as <b>IDOLiSH7</b>. Their brilliantly shining dancing forms onstage eventually begin captivating the hearts of the people. In the glorious but sometimes harsh world of idols, they aim for the top with dreams in their hearts!</p>"", 'updated': 1628688100, '_links': {'self': {'href': 'https://api.tvmaze.com/shows/33463'}, 'previousepisode': {'href': 'https://api.tvmaze.com/episodes/2146076'}}}}"
1981601,https://www.tvmaze.com/episodes/1981601/peytons-places-2x04-fran-tarkenton,Fran Tarkenton,2,4.0,regular,2020-12-20,,2020-12-20T17:00:00+00:00,30.0,{'average': None},,,{'self': {'href': 'https://api.tvmaze.com/episodes/1981601'}},"{'show': {'id': 43207, 'url': 'https://www.tvmaze.com/shows/43207/peytons-places', 'name': ""Peyton's Places"", 'type': 'Documentary', 'language': 'English', 'genres': ['History', 'Sports'], 'status': 'Running', 'runtime': 30, 'averageRuntime': 29, 'premiered': '2019-07-29', 'ended': None, 'officialSite': 'http://www.espn.com/watch/series/2043dd20-9cc0-4abe-b652-c8e7dfdfefa0/peyton-s-places', 'schedule': {'time': '', 'days': ['Sunday']}, 'rating': {'average': None}, 'weight': 41, 'network': None, 'webChannel': {'id': 265, 'name': 'ESPN+', 'country': {'name': 'United States', 'code': 'US', 'timezone': 'America/New_York'}, 'officialSite': None}, 'dvdCountry': None, 'externals': {'tvrage': None, 'thetvdb': 362863, 'imdb': 'tt10241812'}, 'image': {'medium': 'https://static.tvmaze.com/uploads/images/medium_portrait/206/516930.jpg', 'original': 'https://static.tvmaze.com/uploads/images/original_untouched/206/516930.jpg'}, 'summary': ""<p><b>Peyton's Places</b> offers a fun, insightful tour through 100 years of football, following the sport and the league's rise to an American cultural touchstone. For nearly a year, Manning has crisscrossed the country, visiting the people and places that have played an important part in the making of the NFL—highlighting memorable events, teams, players, and trends over the past century.</p>"", 'updated': 1647692257, '_links': {'self': {'href': 'https://api.tvmaze.com/shows/43207'}, 'previousepisode': {'href': 'https://api.tvmaze.com/episodes/2043448'}}}}"
1969229,https://www.tvmaze.com/episodes/1969229/til-deg-fra-meg-1x04-episode-4,Episode 4,1,4.0,regular,2020-12-20,22:35,2020-12-20T21:35:00+00:00,29.0,{'average': None},"{'medium': 'https://static.tvmaze.com/uploads/images/medium_landscape/285/714233.jpg', 'original': 'https://static.tvmaze.com/uploads/images/original_untouched/285/714233.jpg'}",,{'self': {'href': 'https://api.tvmaze.com/episodes/1969229'}},"{'show': {'id': 51894, 'url': 'https://www.tvmaze.com/shows/51894/til-deg-fra-meg', 'name': 'Til deg fra meg', 'type': 'Reality', 'language': 'Norwegian', 'genres': [], 'status': 'To Be Determined', 'runtime': 30, 'averageRuntime': 29, 'premiered': '2020-11-29', 'ended': None, 'officialSite': 'https://tv.nrk.no/serie/til-deg-fra-meg', 'schedule': {'time': '22:15', 'days': ['Sunday']}, 'rating': {'average': None}, 'weight': 2, 'network': {'id': 91, 'name': 'NRK1', 'country': {'name': 'Norway', 'code': 'NO', 'timezone': 'Europe/Oslo'}, 'officialSite': None}, 'webChannel': {'id': 238, 'name': 'NRK TV', 'country': {'name': 'Norway', 'code': 'NO', 'timezone': 'Europe/Oslo'}, 'officialSite': None}, 'dvdCountry': None, 'externals': {'tvrage': None, 'thetvdb': None, 'imdb': None}, 'image': None, 'summary': ""<p>In this year's Advent series, Per Sundnes meets people who are going to give away a Christmas song. They themselves have experienced more adversity than most of us. Who do they want to give a special Christmas song to?</p>"", 'updated': 1608504020, '_links': {'self': {'href': 'https://api.tvmaze.com/shows/51894'}, 'previousepisode': {'href': 'https://api.tvmaze.com/episodes/1969229'}}}}"
1974096,https://www.tvmaze.com/episodes/1974096/wwe-ppv-on-wwe-network-2020-12-20-tlc-tables-ladders-chairs-2020-tropicana-field-in-st-petersburg-fl,"TLC: Tables, Ladders & Chairs 2020 - Tropicana Field in St. Petersburg, FL",2020,14.0,regular,2020-12-20,19:00,2020-12-21T00:00:00+00:00,180.0,{'average': None},"{'medium': 'https://static.tvmaze.com/uploads/images/medium_landscape/401/1003458.jpg', 'original': 'https://static.tvmaze.com/uploads/images/original_untouched/401/1003458.jpg'}",,{'self': {'href': 'https://api.tvmaze.com/episodes/1974096'}},"{'show': {'id': 2855, 'url': 'https://www.tvmaze.com/shows/2855/wwe-ppv-on-wwe-network', 'name': 'WWE PPV on WWE Network', 'type': 'Sports', 'language': 'English', 'genres': [], 'status': 'Running', 'runtime': 180, 'averageRuntime': 193, 'premiered': '1985-03-31', 'ended': None, 'officialSite': 'http://www.wwe.com/events', 'schedule': {'time': '20:00', 'days': ['Sunday']}, 'rating': {'average': 8}, 'weight': 95, 'network': None, 'webChannel': {'id': 347, 'name': 'Peacock', 'country': {'name': 'United States', 'code': 'US', 'timezone': 'America/New_York'}, 'officialSite': 'https://www.peacocktv.com/'}, 'dvdCountry': None, 'externals': {'tvrage': None, 'thetvdb': None, 'imdb': None}, 'image': {'medium': 'https://static.tvmaze.com/uploads/images/medium_portrait/401/1002874.jpg', 'original': 'https://static.tvmaze.com/uploads/images/original_untouched/401/1002874.jpg'}, 'summary': '<p>Beginning with the 2014 Extreme Rules Pay-Per-View on 4 May 2014 the WWE began airing all of their Wrestling Pay-Per-Views exclusively on the WWE Network. Subscribers who pay the $9.95 monthly fee will be able to view any Pay-Per-Views past, present and in the future exclusively on the WWE Network at no additional charge as long as their monthly fees are paid up-to-date.</p>', 'updated': 1652097920, '_links': {'self': {'href': 'https://api.tvmaze.com/shows/2855'}, 'previousepisode': {'href': 'https://api.tvmaze.com/episodes/2201521'}, 'nextepisode': {'href': 'https://api.tvmaze.com/episodes/2201522'}}}}"
2041984,https://www.tvmaze.com/episodes/2041984/submission-underground-2020-12-20-submission-underground-19,Submission Underground 19,2020,9.0,regular,2020-12-20,20:00,2020-12-21T01:00:00+00:00,120.0,{'average': None},,,{'self': {'href': 'https://api.tvmaze.com/episodes/2041984'}},"{'show': {'id': 50162, 'url': 'https://www.tvmaze.com/shows/50162/submission-underground', 'name': 'Submission Underground', 'type': 'Sports', 'language': 'English', 'genres': [], 'status': 'Running', 'runtime': 120, 'averageRuntime': 120, 'premiered': '2016-07-17', 'ended': None, 'officialSite': 'https://www.tapology.com/fightcenter/promotions/2861-submission-underground-sug', 'schedule': {'time': '20:00', 'days': ['Saturday']}, 'rating': {'average': None}, 'weight': 17, 'network': None, 'webChannel': {'id': 45, 'name': 'UFC Fight Pass', 'country': {'name': 'United States', 'code': 'US', 'timezone': 'America/New_York'}, 'officialSite': None}, 'dvdCountry': None, 'externals': {'tvrage': None, 'thetvdb': 387946, 'imdb': None}, 'image': {'medium': 'https://static.tvmaze.com/uploads/images/medium_portrait/271/679188.jpg', 'original': 'https://static.tvmaze.com/uploads/images/original_untouched/271/679188.jpg'}, 'summary': '<p>Submission Underground is a grappling event presented by Chael Sonnen and UFC Fight Pass!</p>', 'updated': 1614930973, '_links': {'self': {'href': 'https://api.tvmaze.com/shows/50162'}, 'previousepisode': {'href': 'https://api.tvmaze.com/episodes/2041986'}}}}"
2234690,https://www.tvmaze.com/episodes/2234690/one-mo-chance-1x10-new-york-new-york-part-2,"New York, New York Part 2",1,10.0,regular,2020-12-20,20:00,2020-12-21T01:00:00+00:00,51.0,{'average': None},"{'medium': 'https://static.tvmaze.com/uploads/images/medium_landscape/382/955841.jpg', 'original': 'https://static.tvmaze.com/uploads/images/original_untouched/382/955841.jpg'}","<p>On a journey to find love, Chance invites 15 beautiful ""ladies"" into his home. Each week he will put the hopefuls through various challenges to test their compatibility among other things. However, with constant infighting between the contestants, will Chance be able to finally find his happily ever after?</p>",{'self': {'href': 'https://api.tvmaze.com/episodes/2234690'}},"{'show': {'id': 59398, 'url': 'https://www.tvmaze.com/shows/59398/one-mo-chance', 'name': ""One Mo' Chance"", 'type': 'Reality', 'language': 'English', 'genres': [], 'status': 'Running', 'runtime': None, 'averageRuntime': 47, 'premiered': '2020-10-11', 'ended': None, 'officialSite': 'https://www.thezeusnetwork.com/one-mo-chance', 'schedule': {'time': '20:00', 'days': ['Sunday']}, 'rating': {'average': None}, 'weight': 57, 'network': None, 'webChannel': {'id': 331, 'name': 'Zeus', 'country': {'name': 'United States', 'code': 'US', 'timezone': 'America/New_York'}, 'officialSite': None}, 'dvdCountry': None, 'externals': {'tvrage': None, 'thetvdb': 390130, 'imdb': 'tt14369906'}, 'image': {'medium': 'https://static.tvmaze.com/uploads/images/medium_portrait/382/955908.jpg', 'original': 'https://static.tvmaze.com/uploads/images/original_untouched/382/955908.jpg'}, 'summary': '<p>From the breakdown of his relationship with the mother of his children, to the death of his brother and partner Real,"" the last few years have been personally tough for Kamal Chance Givens.\xa0However, the original Stallionaire is now ready to get back on his horse to give love another shot.\xa0During Chance return to reality television we\'ll watch as he goes it alone to find the true love of his life in this new dating competition series.</p>', 'updated': 1649330631, '_links': {'self': {'href': 'https://api.tvmaze.com/shows/59398'}, 'previousepisode': {'href': 'https://api.tvmaze.com/episodes/2308893'}}}}"
